{
  "TaskArn": "arn:aws:datasync:us-east-1:123456789012:task/task-01234567890EXAMPLE",
  "Name": "MyDataSyncTask",
  "Status": "AVAILABLE",
  "SourceLocationArn": "arn:aws:datasync:us-east-1:123456789012:location/loc-01234EXAMPLE",
  "DestinationLocationArn": "arn:aws:datasync:us-east-1:123456789012:location/loc-89012EXAMPLE"
}